{
  "$schema": "https://json-schema.org/draft/2020-12/schema",
  "$id": "https://genesis.dev/schemas/template-manifest.schema.json",
  "title": "Genesis Template Manifest",
  "description": "Schema for genesis.json template manifest files",
  "type": "object",
  "required": [
    "name",
    "version",
    "variables",
    "files"
  ],
  "properties": {
    "name": {
      "type": "string",
      "pattern": "^[a-z][a-z0-9-]*$",
      "description": "Template name in kebab-case"
    },
    "version": {
      "type": "string",
      "pattern": "^\\d+\\.\\d+\\.\\d+",
      "description": "Semantic version"
    },
    "description": {
      "type": "string",
      "maxLength": 500,
      "description": "Human-readable template description"
    },
    "variables": {
      "type": "object",
      "additionalProperties": {
        "$ref": "#/$defs/variable"
      },
      "description": "Template variable definitions"
    },
    "files": {
      "type": "array",
      "items": {
        "type": "string"
      },
      "minItems": 1,
      "description": "List of template files to process"
    },
    "directories": {
      "type": "array",
      "items": {
        "type": "string"
      },
      "description": "Directories to create"
    },
    "conditionalFiles": {
      "type": "object",
      "additionalProperties": {
        "type": "array",
        "items": {
          "type": "string"
        }
      },
      "description": "Files included conditionally based on variables"
    },
    "postGenerate": {
      "type": "array",
      "items": {
        "type": "string"
      },
      "description": "Commands to run after generation"
    },
    "dependencies": {
      "type": "array",
      "items": {
        "type": "string"
      },
      "description": "Other templates this depends on"
    }
  },
  "$defs": {
    "variable": {
      "type": "object",
      "required": [
        "type"
      ],
      "properties": {
        "type": {
          "type": "string",
          "enum": [
            "string",
            "number",
            "boolean",
            "array",
            "object"
          ]
        },
        "required": {
          "type": "boolean",
          "default": false
        },
        "default": {
          "description": "Default value for the variable"
        },
        "description": {
          "type": "string"
        },
        "enum": {
          "type": "array",
          "description": "Allowed values"
        },
        "pattern": {
          "type": "string",
          "description": "Regex pattern for string validation"
        },
        "minimum": {
          "type": "number",
          "description": "Minimum value for numbers"
        },
        "maximum": {
          "type": "number",
          "description": "Maximum value for numbers"
        }
      }
    }
  }
}
